{"$schema":"https://json-schema.org/draft/2020-12/schema","additionalProperties":false,"properties":{"cases":{"items":{"additionalProperties":false,"properties":{"case_id":{"pattern":"^[A-Za-z0-9][A-Za-z0-9._:-]{0,127}$","type":"string"},"inputs":{"type":"object"}},"required":["case_id","inputs"],"type":"object"},"minItems":1,"type":"array"},"id":{"pattern":"^[A-Za-z0-9][A-Za-z0-9._:-]{0,127}$","type":"string"},"relation_id":{"pattern":"^[A-Za-z0-9][A-Za-z0-9._:-]{0,127}$","type":"string"},"relation_profile_id":{"pattern":"^[A-Za-z0-9][A-Za-z0-9._:-]{0,127}$","type":"string"},"relation_profile_sha256":{"pattern":"^[0-9a-f]{64}$","type":"string"},"relation_profile_version":{"pattern":"^[A-Za-z0-9][A-Za-z0-9._:-]{0,127}$","type":"string"},"schema":{"const":"profiled-relation-fixture.v0"}},"required":["schema","id","relation_profile_id","relation_profile_version","relation_id","cases"],"type":"object"}
