{"cases":[{"case_id":"terminal_hash_substitution","inputs":{"record":{"admission":{"bound_envelope_hash":"faa282ce02c8b7759a66ada63abd4b6c9ae38035f21f288cc898dd6e5067d5b3","signer_identity_evidence":{"pubkey":"6786e18a864893a900bd9858e650f67ccc3513f248fed374b591e2ff6922fbb7","publication_pointer":"https://api.babyblueviper.com/ledger (verifier_pubkey is self-described in the proof)"},"verdict_event":{"content":"{\"artifact_hash\":\"faa282ce02c8b7759a66ada63abd4b6c9ae38035f21f288cc898dd6e5067d5b3\",\"artifact_type\":\"onchain_action\",\"confidence\":0.95,\"independent_nodes\":[\"https://invinoveritas-castra.babyblueviper.workers.dev/verify\",\"https://babyblueviper1--2aba75da693711f185891607ee4eb77e.web.val.run\"],\"platform\":\"invinoveritas\",\"schema\":\"invinoveritas.verdict_proof.v1\",\"summary_hash\":\"f2da0ca789225431388a94573da023098fc956b5634426276f886ca040f04585\",\"verdict\":\"reject\",\"verified_at\":1782598909,\"verifier_pubkey\":\"6786e18a864893a900bd9858e650f67ccc3513f248fed374b591e2ff6922fbb7\",\"verify_how\":\"Easiest: install the offline verifier above and recompute locally. Or POST this proof's signed `event` to verify_url (or an independent_node), OR run NIP-01 yourself: recompute the Nostr event id = sha256([0,pubkey,created_at,kind,tags,content]), verify the schnorr signature against verifier_pubkey. valid \\u21d2 invinoveritas issued this, untampered. No trust required.\",\"verify_offline\":\"npm i invinoveritas-verify  \\u00b7  pip install invinoveritas-verify  \\u2014 recompute this proof on your own machine against verifier_pubkey; you never have to call us.\",\"verify_url\":\"https://api.babyblueviper.com/verify-proof\"}","created_at":1782598909,"id":"32f4f67461b41a151f3e7379e069856372e35ce71242b64b47e35d5c1634cd6a","kind":30078,"pubkey":"6786e18a864893a900bd9858e650f67ccc3513f248fed374b591e2ff6922fbb7","sig":"6e3f45fb37eb8522502f5d2548d47cfabeb0b07e77df45af5400fe55786d2ee65592cd69fc46879b2edbadd6abb08f7b2cea76e57ea686204db9b585eeaf9756","tags":[["d","invinoveritas-proof-faa282ce02c8b7759a66ada63abd4b6c9ae38035f21f288cc898dd6e5067d5b3-1782598909-1d5773ce"],["t","invinoveritas"],["t","proof"],["schema","invinoveritas.verdict_proof.v1"]]}},"anchor":{"accepted_anchor_point":{"block_time":1782600300,"note":"DECLARED trust input. A deployment verifier resolves this from the anchor proof via `ots verify`; see live_confirmed_anchor.json for a real Bitcoin-confirmed instance.","source":"opentimestamps-bitcoin"},"anchor_proof_ots_b64":null,"commitment_digest":"32f4f67461b41a151f3e7379e069856372e35ce71242b64b47e35d5c1634cd6a","terminal_outcome_time":1782600600},"canonical_envelope":{"canonical_bytes_utf8":"{\"action\":\"erc20_transfer\",\"amount\":\"115792089237316195423570985008687907853269984665640564039457584007913129639935\",\"chainId\":\"8453\",\"spender\":\"0x1f9840a85d5aF5bf1D1762F925BDADdC4201F984\",\"to\":\"0x000000000000000000000000000000000000dEaD\",\"token\":\"0xA0b86991c6218b36c1d19D4a2e9Eb0cE3606eB48\"}","canonicalization":"json-sorted-keys-utf8-nows","expected_envelope_hash":"faa282ce02c8b7759a66ada63abd4b6c9ae38035f21f288cc898dd6e5067d5b3","raw_input":{"action":"erc20_transfer","amount":"115792089237316195423570985008687907853269984665640564039457584007913129639935","chainId":"8453","spender":"0x1f9840a85d5aF5bf1D1762F925BDADdC4201F984","to":"0x000000000000000000000000000000000000dEaD","token":"0xA0b86991c6218b36c1d19D4a2e9Eb0cE3606eB48"}},"chain":{"pre_action":{"action_ref":"act-faa282ce02c8b775","actor_pubkey":"59ae1763f5bb7bfe78525dc1c98de50ba439b782e6824d89d8af313b14c31230","created_at":1782599900,"envelope_hash":"faa282ce02c8b7759a66ada63abd4b6c9ae38035f21f288cc898dd6e5067d5b3"},"terminal":{"action_ref":"act-faa282ce02c8b775","executed_envelope_hash":"1111111111111111111111111111111111111111111111111111111111111111","result":"executed","terminal_outcome_time":1782600600}},"trust_policy":{"independent_verifier_pubkeys":["6786e18a864893a900bd9858e650f67ccc3513f248fed374b591e2ff6922fbb7"],"policy":"An admission verdict counts as independent iff its signing pubkey is in independent_verifier_pubkeys AND is not the actor/executor pubkey in the chain."}}}}],"id":"JEX-RSI-002","relation_id":"signed-verdict-terminal-record-binding","relation_profile_id":"erc8299.judgment-record-binding.v0","relation_profile_version":"0","schema":"profiled-relation-fixture.v0"}
