{"cases":[{"case_id":"wrong_job","inputs":{"amount":"1000000000000000000","attestor":"0xe05fcc23807536bee418f142d19fa0d21bb0cff7","consumer":"0x00000000000000000000000000000000000010c0","deadline":"86400","job_id":"0x710a6c405dad0a35ab62c5fa8b52bec4cc4754beff2c96568d901d3b2be9b20d","mode":"execute","open_jobs":["0xfcf3e85579d8e8b2a552598f7ee2dec5ae2f5680e30ef46d6b7b1f32fa40f9ef","0x710a6c405dad0a35ab62c5fa8b52bec4cc4754beff2c96568d901d3b2be9b20d"],"prior":"none","provider":"0x00000000000000000000000000000000000010b0","relayer":"0x00000000000000000000000000000000000010d0","result_hash":"0x39ec14ae2c3f0f117064439fafc334226d904db5679f0ae2e8d731c01843cb9a","signature":"0x65219be7a87b847abceee541058ff2e216b6d5188f8c2fc6a0ab22e7810f506d7c1577d397eeeb5335ffebe71c7cf18aab1aaa84583a415861c257e4ec9f5ba01c"}},{"case_id":"wrong_result","inputs":{"amount":"1000000000000000000","attestor":"0xe05fcc23807536bee418f142d19fa0d21bb0cff7","consumer":"0x00000000000000000000000000000000000010c0","deadline":"86400","job_id":"0xfcf3e85579d8e8b2a552598f7ee2dec5ae2f5680e30ef46d6b7b1f32fa40f9ef","mode":"execute","open_jobs":["0xfcf3e85579d8e8b2a552598f7ee2dec5ae2f5680e30ef46d6b7b1f32fa40f9ef","0x710a6c405dad0a35ab62c5fa8b52bec4cc4754beff2c96568d901d3b2be9b20d"],"prior":"none","provider":"0x00000000000000000000000000000000000010b0","relayer":"0x00000000000000000000000000000000000010d0","result_hash":"0x2222222222222222222222222222222222222222222222222222222222222222","signature":"0x65219be7a87b847abceee541058ff2e216b6d5188f8c2fc6a0ab22e7810f506d7c1577d397eeeb5335ffebe71c7cf18aab1aaa84583a415861c257e4ec9f5ba01c"}}],"id":"CE-RSI-002","relation_id":"job-bound-release","relation_profile_id":"consult-escrow.release-binding.v0","relation_profile_version":"0","schema":"profiled-relation-fixture.v0"}
