{"cases":[{"case_id":"binding_control","inputs":{"artifact":{"a":2,"b":1},"artifact_commit":"45b46bf7df3a60b32583291f577a36bf19d22f00","binding_record":{"binding_subject":"tsei.frozen-artifact","effective_commit":{"commit":"45b46bf7df3a60b32583291f577a36bf19d22f00","repository":"github.com/pipavlo82/crystal-receipt"},"non_retroactivity":{"byte_reproduction_is_not_binding":true,"historical_binding_requires_separate_record":true,"prospective_only":true},"producer_conformance":{"implementation":{"path":"conformance/tsei-invariant-discrimination-v0/encode-json-utf8-lf-v0.ts","repository":"github.com/pipavlo82/crystal-receipt","revision":"45b46bf7df3a60b32583291f577a36bf19d22f00","sha256":"a82587be42aa3d2e382f02e3ae633efe67b94b5831cb043131b3bc174e4fe3f9"},"qualification":{"method":"passes-pinned-serializer-vectors","vector_count":48,"vectors":{"path":"conformance/encode-json-utf8-lf-v0/encode-json-utf8-lf-v0.vectors.json","repository":"github.com/trustless-ai/recompute-kit","revision":"f1d75a530761c983e8b6900f036935ac7758538c","sha256":"8d53ab1d3dfb2de1ba9db23ed06d6864b08b516451938a4b1f6db6bcdcf1950f"}}},"serializer_contract":{"id":"encode-json-utf8-lf.v0","spec":{"path":"conformance/encode-json-utf8-lf-v0/encode-json-utf8-lf-v0.spec.md","repository":"github.com/trustless-ai/recompute-kit","revision":"f1d75a530761c983e8b6900f036935ac7758538c","sha256":"22207f8c4047044414da98b5497a2c9683aea14a7a498fc1819a9094c920a1f9"},"vectors":{"path":"conformance/encode-json-utf8-lf-v0/encode-json-utf8-lf-v0.vectors.json","repository":"github.com/trustless-ai/recompute-kit","revision":"f1d75a530761c983e8b6900f036935ac7758538c","sha256":"8d53ab1d3dfb2de1ba9db23ed06d6864b08b516451938a4b1f6db6bcdcf1950f"}}},"binding_subject":"tsei.frozen-artifact","claim":"serializer_binding","producer_commit":"45b46bf7df3a60b32583291f577a36bf19d22f00","registry_commit":"15f7f59ac47b3358492bd5741143c418b5d657f5","serializer_id":"encode-json-utf8-lf.v0"}}],"id":"TSEI-RSI-001","relation_id":"serializer-adoption-boundary","relation_profile_id":"tsei.serializer-adoption.v0","relation_profile_sha256":"e35866da9b070603016233fda75d2a36efcf23f8782510b05ffb97d0a3cd345a","relation_profile_version":"0","schema":"profiled-relation-fixture.v0"}
