{"cases":[{"case_id":"component_mirror","inputs":{"producer":{"component":"renamed.display","does_not_establish":[],"establishes":[{"authority_class":"INDEPENDENT_RECOMPUTATION","claim_type":"DETERMINISTIC_ACTION_RESULT","scope":"action:demo-001/output","verification_time":"receipt.verified_at"}]},"requirement":{"authority_class":"INDEPENDENT_RECOMPUTATION","claim_type":"DETERMINISTIC_ACTION_RESULT","scope":"action:demo-001/output","verification_time":"receipt.verified_at"}}}],"id":"SABI-RSI-013","relation_id":"claim-authority-scope-time-binding","relation_profile_id":"semantic-abi.claim-edge.v0","relation_profile_version":"0","schema":"profiled-relation-fixture.v0"}
