{"cases":[{"case_id":"ancestor_revoked","inputs":{"engine":"cursor","observation_time":"101","periods":[0],"roots":[{"agent":"0x00000000000000000000000000000000000000a0","cap":"1000","issuer":"0x0000000000000000000000000000000000000015","period_anchor":"100","period_length":"100","salt":"0x0000000000000000000000000000000000000000000000000000000000000001"}],"steps":[{"agent":"0x00000000000000000000000000000000000000a1","amount":"0","caller":"0x00000000000000000000000000000000000000a0","node":0,"op":"delegate","root":0,"time":"101"},{"agent":"0x00000000000000000000000000000000000000a2","amount":"0","caller":"0x00000000000000000000000000000000000000a1","node":1,"op":"delegate","root":0,"time":"101"},{"agent":"0x0000000000000000000000000000000000000000","amount":"400","caller":"0x00000000000000000000000000000000000000a2","node":2,"op":"draw","root":0,"time":"101"},{"agent":"0x0000000000000000000000000000000000000000","amount":"0","caller":"0x0000000000000000000000000000000000000015","node":1,"op":"revoke","root":0,"time":"101"},{"agent":"0x0000000000000000000000000000000000000000","amount":"1","caller":"0x00000000000000000000000000000000000000a2","node":2,"op":"draw","root":0,"time":"101"},{"agent":"0x00000000000000000000000000000000000000a3","amount":"0","caller":"0x00000000000000000000000000000000000000a1","node":1,"op":"delegate","root":0,"time":"101"},{"agent":"0x0000000000000000000000000000000000000000","amount":"600","caller":"0x00000000000000000000000000000000000000a0","node":0,"op":"draw","root":0,"time":"101"}]}}],"id":"AGG-RSI-012","relation_id":"root-budget-conservation","relation_profile_id":"erc8312.aggregate-budget.v0","relation_profile_version":"0","schema":"profiled-relation-fixture.v0"}
