{"cases":[{"case_id":"control","inputs":{"baseline":{"manifest":{},"semantic_artifact":{"challenge_id":"observed_not_validated","expected_conformance_observation":"preserve semantic non-elevation","profile_id":"counterfactual-review-v0"}},"candidate":{"manifest":{},"semantic_artifact":{"challenge_id":"observed_not_validated","expected_conformance_observation":"preserve semantic non-elevation","profile_id":"counterfactual-review-v0"}}}},{"case_id":"relation_substitution","inputs":{"baseline":{"manifest":{},"semantic_artifact":{"challenge_id":"observed_not_validated","expected_conformance_observation":"preserve semantic non-elevation","profile_id":"counterfactual-review-v0"}},"candidate":{"manifest":{},"semantic_artifact":{"challenge_id":"observed_not_validated","expected_conformance_observation":"incorrectly promote observation","profile_id":"counterfactual-review-v0"}}}}],"id":"CR-RSI-001","relation_id":"counterfactual_audit_boundary.semantic_snapshot_equivalence.v0","relation_profile_id":"crystal-receipt.semantic-snapshot.v0","relation_profile_sha256":"17f072840b3dd50f23fafaadafe6ee8321b771f6c211e8af5bc95b17ee0229fb","relation_profile_version":"0","schema":"profiled-relation-fixture.v0"}
