{"cases":[{"case_id":"stale_snapshot","inputs":{"artifact":{"anchor_time":1789000000,"anchored":true,"pq_companion":{"pq_pubkey":"8488157a2b55ba45f7dd6768db29bc9013936ea668a3001ca33cc817328c373c714d84d3872f1bb619bec02268ab34b5","present":true,"valid":true}},"bindings":[{"binding_anchor_time":1785423299,"name":"kya-l4-genesis","pq_pubkey":"638c79a2210c85e8cb349fc72a6583b7ff82e003ff02117f8f7f9d8cc3fb92a33e7496d987beb05f22bf12ecf34bc7aa","secp256k1_pubkey":"0xFf9a176577Fb42b6bc9c19fd05a241e8fCd0ca14"},{"binding_anchor_time":1788000000,"name":"kya-l4-rotation-1","pq_pubkey":"8488157a2b55ba45f7dd6768db29bc9013936ea668a3001ca33cc817328c373c714d84d3872f1bb619bec02268ab34b5","secp256k1_pubkey":"0xFf9a176577Fb42b6bc9c19fd05a241e8fCd0ca14"}],"claim":"policy_eligibility","consumer_cutoff":1787000000,"current_asof":1789000000,"reported_algorithm":"ML-DSA","snapshot_key":"638c79a2210c85e8cb349fc72a6583b7ff82e003ff02117f8f7f9d8cc3fb92a33e7496d987beb05f22bf12ecf34bc7aa"}}],"id":"PQ-RSI-005","relation_id":"policy-cutoff-asof","relation_profile_id":"pq.policy-asof.v0","relation_profile_sha256":"3fc3dd5e1ff0f3a59bfc9fdbcf5f456204d86747012941c5bae2ad01d2935b34","relation_profile_version":"0","schema":"profiled-relation-fixture.v0"}
