{"cases":[{"case_id":"bilateral_binding","inputs":{"claim":"digest_binding","transition":{"amendment":{"escrow_ref":"a1b2c3d4e5f60718293a4b5c6d7e8f90a1b2c3d4e5f60718293a4b5c6d7e8f90#0","new_profile_commitment":"c5561c0ddd64f3b971563ef2ec08b812b2aaad3787ed8de3cc39d69d9fd35984","prior_profile_commitment":"cc458bd42359a4dcd873cd3bde38cc45e5562f51f674c214b4659030317c70ce","schema":"profile-amendment.v0"},"authorizations":{"buyer":{"party":"buyer","pubkey":"bbbbbbbbbbbbbbbbbbbbbbbbbbbbbbbbbbbbbbbbbbbbbbbbbbbbbbbbbbbbbbbbbbbbbbbbbbbbbbbbbbbbbbbbbbbbbbbb","signed_digest":"6e1e3f6df4a77a9e38b0eaaf64f5d5eb3297acf4dbdc9e0c80e14c1ce93324e5"},"supplier":{"party":"supplier","pubkey":"cccccccccccccccccccccccccccccccccccccccccccccccccccccccccccccccccccccccccccccccccccccccccccccccc","signed_digest":"6e1e3f6df4a77a9e38b0eaaf64f5d5eb3297acf4dbdc9e0c80e14c1ce93324e5"}},"escrow_ref":"a1b2c3d4e5f60718293a4b5c6d7e8f90a1b2c3d4e5f60718293a4b5c6d7e8f90#0","in_force_profile":{"admissible_evidence":["onchain_receipt"],"jury_resolved":["reasoning_quality"],"mechanically_checkable":["result_hash_matches"],"schema":"verification-profile.v0","version":1},"proposed_profile":{"admissible_evidence":["onchain_receipt"],"jury_resolved":["reasoning_quality"],"mechanically_checkable":["result_hash_matches","chain_id_matches"],"schema":"verification-profile.v0","version":2},"required_parties":["buyer","supplier"]},"verdict":null}},{"case_id":"pubkey_representation_change","inputs":{"claim":"digest_binding","transition":{"amendment":{"escrow_ref":"a1b2c3d4e5f60718293a4b5c6d7e8f90a1b2c3d4e5f60718293a4b5c6d7e8f90#0","new_profile_commitment":"c5561c0ddd64f3b971563ef2ec08b812b2aaad3787ed8de3cc39d69d9fd35984","prior_profile_commitment":"cc458bd42359a4dcd873cd3bde38cc45e5562f51f674c214b4659030317c70ce","schema":"profile-amendment.v0"},"authorizations":{"buyer":{"party":"buyer","pubkey":"dededededededededededededededededededededededededededededededededededededededededededededededede","signed_digest":"6e1e3f6df4a77a9e38b0eaaf64f5d5eb3297acf4dbdc9e0c80e14c1ce93324e5"},"supplier":{"party":"supplier","pubkey":"cccccccccccccccccccccccccccccccccccccccccccccccccccccccccccccccccccccccccccccccccccccccccccccccc","signed_digest":"6e1e3f6df4a77a9e38b0eaaf64f5d5eb3297acf4dbdc9e0c80e14c1ce93324e5"}},"escrow_ref":"a1b2c3d4e5f60718293a4b5c6d7e8f90a1b2c3d4e5f60718293a4b5c6d7e8f90#0","in_force_profile":{"admissible_evidence":["onchain_receipt"],"jury_resolved":["reasoning_quality"],"mechanically_checkable":["result_hash_matches"],"schema":"verification-profile.v0","version":1},"proposed_profile":{"admissible_evidence":["onchain_receipt"],"jury_resolved":["reasoning_quality"],"mechanically_checkable":["result_hash_matches","chain_id_matches"],"schema":"verification-profile.v0","version":2},"required_parties":["buyer","supplier"]},"verdict":null}}],"id":"RVR-RSI-003","relation_id":"profile-and-verdict-digest-binding","relation_profile_id":"rvr.digest-binding.v0","relation_profile_sha256":"2f752225295dc88805b6b618d84c3c511f4f447e6e4648037277523ae8fe17df","relation_profile_version":"0","schema":"profiled-relation-fixture.v0"}
