{"cases":[{"case_id":"normative_obligation","inputs":{"consumer_pin":"direct","observation_time":"1700000000","program_generation":"sdk","program_key":"0x15dfad359ae3d919488f92128f12290d908220925f263eeec28e8a97f21a372a","proof_generation":"sdk","verdict":{"actionCommitment":"0x7ccb7a4e9d51128b951cbeddefaec1140180a3d13f6eae6f06596dc432057cfa","agentId":"7","decision":"1","domainId":"0x000000000000000000000000000000000000000000000000000000000000002a","executor":"0x00000000000000000000000000000000000000e0","expiry":"1900000000","nullifier":"0x041271fcaf479f6ab927df3a03f74d3809e9f49d880cd7a9595c8dc0a58a5e03","policyKind":"0","policyRoot":"0x053d4542d140ad2350a0ee79fae4a522821274e428bd881e7e803ecd816635ac"}}}],"id":"CAPV-RSI-001","relation_id":"proof-public-input-generation-binding","relation_profile_id":"capv.expiry-generation.v0","relation_profile_version":"0","schema":"profiled-relation-fixture.v0"}
