{"cases":[{"case_id":"workflow_substitution","inputs":{"accepted":{"blockSelector":{"blockHash":"0xaaaaaaaaaaaaaaaaaaaaaaaaaaaaaaaaaaaaaaaaaaaaaaaaaaaaaaaaaaaaaaaa","kind":"block_hash"},"chainId":"31337","fingerprint":"sha256:bbbbbbbbbbbbbbbbbbbbbbbbbbbbbbbbbbbbbbbbbbbbbbbbbbbbbbbbbbbbbbbb","rpcUrl":"http://127.0.0.1:8545","workflowAddress":"0x1000000000000000000000000000000000000001"},"agent_id":"340282366920938463463374607431768211457","current":{"blockSelector":{"blockHash":"0xaaaaaaaaaaaaaaaaaaaaaaaaaaaaaaaaaaaaaaaaaaaaaaaaaaaaaaaaaaaaaaaa","kind":"block_hash"},"chainId":"31337","fingerprint":"sha256:bbbbbbbbbbbbbbbbbbbbbbbbbbbbbbbbbbbbbbbbbbbbbbbbbbbbbbbbbbbbbbbb","rpcUrl":"http://127.0.0.1:8545","workflowAddress":"0x3000000000000000000000000000000000000003"},"member":{"agent_id":"340282366920938463463374607431768211457","block_hash":"0xaaaaaaaaaaaaaaaaaaaaaaaaaaaaaaaaaaaaaaaaaaaaaaaaaaaaaaaaaaaaaaaa","is_member":true,"wallet":"0x2000000000000000000000000000000000000002"},"task_hash":"0x1111111111111111111111111111111111111111111111111111111111111111","tool_name":"workflow.execution.erc8301.agent_workflow.get_task"}}],"id":"TAS-RSI-002","relation_id":"verified-workflow-dispatch","relation_profile_id":"tas.context-invocation.v0","relation_profile_version":"0","schema":"profiled-relation-fixture.v0"}
