{"cases":[{"case_id":"positive_precedence","inputs":{"producer":{"component":"demo./verify","does_not_establish":[{"authority_class":"INDEPENDENT_RECOMPUTATION","claim_type":"DETERMINISTIC_ACTION_RESULT","scope":"action:demo-001/output"}],"establishes":[{"authority_class":"INDEPENDENT_RECOMPUTATION","claim_type":"DETERMINISTIC_ACTION_RESULT","scope":"action:demo-001/output","verification_time":"receipt.verified_at"}]},"requirement":{"authority_class":"INDEPENDENT_RECOMPUTATION","claim_type":"DETERMINISTIC_ACTION_RESULT","scope":"action:demo-001/output","verification_time":"receipt.verified_at"}}}],"id":"SABI-RSI-016","relation_id":"claim-authority-scope-time-binding","relation_profile_id":"semantic-abi.claim-edge.v0","relation_profile_version":"0","schema":"profiled-relation-fixture.v0"}
