{"cases":[{"case_id":"hex_case_mirror","inputs":{"address":"0xc02aaa39b223fe8d0a0e5c4f27ead9083c756cc2","header":{"number":"0x18bf439","stateRoot":"0x3cb08f43bb7e9249e250d889871d113a5799264ccff284bf71179f33217481a8"},"response":{"accountProof":["0xF90211A09FCABF41B4C785369E88CF22D3981D1C95BCFE1066F937618DB7E01DD75D9916A080F2187A2F8869012599112354AFE3748BA20A46C5A90FD6B2C43CA50AA46422A043832B63F075C1B4D24D070E193625640362AC2EB11BEFF462745A1B4B3F8425A0BDF0B010A575A54B7C13F10C5D9F2A8F06DB32F2B8127FECB6E6E9AEBE5D8DCAA04F1DAFB0EAD703A11DB691E486AB6E92B817F8CDD78C09D2207466C5BC13249CA024A91DED3AFCB59B01D808702B0763842F671F0C87F0E5DCF752616AF04A205FA09361E03AF372BEC5EDDFE63C114A647FB16576CE9D8E7B3C6BDFB4941CE0722DA02715B7F0CCDA34B63CDDDEA7359E27B9EA6F359D93D10B27A9E02ADF1E04BD1BA024EFFE7ABAB6300393ECFF02C7B8B049BB0B9F2D7F6C87EEBAB9EBAA9C8A44FDA0AB2F92CA997F219436577DC1796658714050C433E17EDF127129B220BC0BAB85A0AD75CC9E9B85D94DF9D0983A13C757937AB47F96BC79227C83163591E70525BAA0F62269D77E3E93DFA8D03E583A39855DFC388451393E41BE255000C7131B172DA07D91958219DC3603C9E533D4A04336C653CCEBE8C33982A10BE36D83DE4F534AA006E9B9D25050A20C60F427EACE06546385464A372F1E40FC1477D0AB14E84DB4A012B07607F500C40865C7524DAA250D0C8C8FD364C1B9F0B02C4FDEBB7AE3A143A090D917F17A132AD555C86EADFB9A4FF1E4E7DDEB4FD66A6F34DBD8D2DDFD608680","0xF90211A0E255D95CFE3FCBFC6DC47773117C62358326E459589B8B61E1638C55CD6A52C3A0BF5ADC0B6A5C124E17A67107B9260CDB66E9635A70D3AA38E6C980E256DDFE3DA065D32D71EF4F987EF081F4B4DFFE815F0A3E44C1F527EA48BE176FA7CE054232A04CEE37C7D999A5F35EF729C8C6ECCB35DEC5FB663D2045F96C087462B390216DA03D492A68A7429496F856F7081B8269089AB75DB9CC8D66D9024A6D82F6D46D06A005D0A800985FB45195C0DF744359105453D9EF4DB83D5A7CA6C2049BF428CD30A0F75094050C9A7C84ADE519061B9766416E5DBF9758DF7C3F1D6FDEF7B28B1561A07E2BE7B32363C989436A66490C4288B3501B0CD997CEEC37E42359162E36268EA0B7DEE5C25A1C8A8C37321C15DE0C4A359FE5C0D3391C6351FFD3322C2A8E2620A002833DDD961C73329FD889E8F752969B80D5B1A759ED41A650674969E6B4F6FAA03D2E7818113CC8E5CF9D2DE4F3FD02BBA547ADEE08F7E81D410920790F359C4CA0BC4FDB40550A726B133F59F3577F6DEB77BB72308DFB36CB312CBEF92795A08BA05CBCEF58A164624B03433BD10944FB85A664C5B528EF4D4E026AF7A8E915F467A09BF77EA5ABE8BD64D75B2FA0B95C1C666BBEDF2733643C19420FEE0E06B7C2F4A04EFAE3B32A17BAD48DD09CA795D769B2CDD8CE8110427AE85EC1752B5679F30CA0EB7894C3B0B90224D2D1AEE156D9A01115104854CE745755FAF30850EBF03BC380","0xF90211A0A4F3C76882FC316BFCD5EAB42786DA14AE70E7739859CCF184957382B225B934A0351761F108314679A25B74493E7D4DD5F2B6A3F8313DCF6F67A1E8717C71F612A08D954911546C940ABDF2E721D4FCFF036423DEE70A2209CCB306FB4984CFD411A00CCBFF395F543E44020E3728F8DF297FC9D43AE8C103D3B581017464243C23C4A0C074EACA10251D0275DE099AB6FEA3AD389843381C0E8BC76F6174E88DCEF6ADA0D74BE35911DFA067341FADC178B0D17055003126EA669EB07D2110F85062A0EDA0980FEDC1C30F9CC569B0D6D9CE9772950D761FDE3F881461EC2C04E163B4DA4EA08E12BAACC1522EBFD7AFB059415D2F5FE711F3F1CDFF9241C6DC4CDFADC9FF80A0F01B09A150B3421BE513F9E355BBCA3DD27A26D1C7EC948C8B959E963ADC89F6A01A7B20B34C3AC0859C9FBACE722A6FFBC55921CBC26504C7E7D9122DB963799EA0668EEFA71CE275F6468652CFFB74C2AB4C50FA60DDB837DC47EDAD9A37872AE1A06983CAB313F25B24A183C9604A028A8315C2043148A6FA584353239F4A587EDFA0AF87B0DA52654D8F33EC7C6AA78F260B318AAFD827FB923FAAF9E2BD07302C82A0CAD9D267939D6D56080E2B9829F1EC2D81ABF1CDAEF30934422B34B0EDE18B46A0BE5309D6B2084B7935CDBEF8D82F9E3D50B560B3027F598C6F9434FEAF5B5851A0BF2847BD05CECF14897E9A8143F86C69C4AB884E489AD89E5ECE3DEEA66930C780","0xF90211A0B3E5C3B5CF073575FC70495AF2E4BC0B77D7C4DB2021FB6B20A7F5D2A1AC62F7A0626136DFC0B7651C199BFAD6B61E0C0D1E5650CDE1A695C04DAC9D2C150830B4A0C4985581651B505B15CEBDA08F53660DEDD87B1F23103CEACEA6A62B4939E20FA0CD29FF0C4CB6830321B65070B7D3F0E34C4F688A51013E52E35FD97F3B1ACF68A04C56608DE579FA87EB67AA0823899AD5F326B0EEF8B33AAF0D0A34B4B32001B2A09FB42725D914DD4A71DACA7EAE44742C74BF9C69243A336ED46DAEBD7F3713F5A0CED6B0FF6CA108C28E9AD917787092EF3B8C0E12FB286E58A543F27A44AFEF30A0B289C2941C0A4EC81F3EC85E7609562EDAA901E3AA03D9871348427E593B38FCA08D4668A0365743314EE9DB78D2CC56655E7000E652D08D7288CF187B9B5FAC43A0F2A0802F0CA429A204973F20F4AF02A0639FC73DA69595A46ACEB9DBE9E1B542A03DDA6C249BF0967F04DDD7CD1ECD98D8FB9EF6FC8C8F4D1976F30E54384A7528A0E19012D64951E6BAF34C91F0D8164B47EB467E1BD1CB114FEB0C92C9CD02DBF9A0A8B120E63356B04094E710B18D7388972E2F3A565EA617E82D14C0264AB6ACA6A0602B102B0CF24086D7DFA0FE5901356E337A17E2D9FDFB3792C7CE2B63A67AFDA0D1A10DCAAF965FC48FE03935EE9C13CFF4981F67DB49451D58F3C92205C9BBD0A086934325CD02E1F3932D013B27EC2E1D38EE38DD204AAAFB09DFFD83FCB9361F80","0xF90211A04262FF58E15A0DB5F25D470BF6E5D01EE51B078AC316A5C1D0C9C8477C107FD9A0D8B9ECB74DBB9348012C5A50B677E204C366B6A59BCDCED5EC70F473B2DBC07EA05551289D7D0CA8E6ED0E9B94EAAEBBDE60817B3C8062D015B39A664A86571F48A0E114704DFCDFC605AB731C8C7D0A750E807A234ECBAAB53EB5C8F0FDA36EC476A08411F5AEF7AC385D03ABD621C1C9863B733FBFC620ED786B24D61D613C7B1340A025D0300730736A5B973395B21E51018C084832563EACC30BD64B16F7650886AAA0D339EACCD8F171B13EAA0AFBEC7B0EC1D5A39F25FF3DEFC0A34898E228878442A094FCDB554A2B537A717CC37F442992342AEE297BD6069A96C0C68BC6A3D4698CA04E3EAE18173A40BACCD0FC364C2B3220A81C41985CB31E039F78AFFCDECD085EA06D49A6C2CE8CB52722E864F1C6AEF2CC843C02914C76C6FB007DB9CFD1D7B0C7A05CB40E6810A22A3E6258182774108B72C3A1962FF46480D9751DBFA66B4D672BA0895FFB095FCFD8C97B1AC08E5A15146282024D29435B1DFE593523A5E261AD8CA0B0C96DDF97B4DF21A269534D709CC74020BF97A9904601103F314CED8C301DFAA07CD8135A7A88294C7EF23B2796EB705D6CB84774F5C84E08954AB53F12CD6774A09C8492A19FF11D58A04AD77CA6D95AA0CA614953B390594975DFB53E4B653D88A0883441B4ECD17B93B876ACEE6AF28A958648B99A1B3D3C159DAE449F9A036CD880","0xF90211A084CC796287F296BA8A48DB60BDC70E0A6452F12D9B69B35BA8664D91A45BEDC4A0B22C12062B8F48D8F92BE9784E41C88365D91B7732DE1D9BF3138830BEDAAC99A0D47C5D8506CAE00C45119ACDE736E877D3D8956899A7CDCC98CFDA4D40D169F8A04F06983240AF1CFDE15FB0BE9C7AABAABC166E6D3F7AD299B6869EF963A6120FA038EBCA901AB26BE6972B06E71A2B6A13B7FED253C5AB88C9E28E8664A03FAF16A0855712345394943B5696820D056061C95BC30647907547009013D4D44F1322BAA09C7A5515F935F6D52D04703044F9407B6334F408A9E26C463AF5306EA3C4E1B4A092785B9F1F414D3DF467823A100A19BE8F098E13885BBA867C4E0C70CD45450AA0276455E60507EAEDC9A329B4F268981FBF6B80A26C6346B3404C75A40AFB46A7A05EF32BB7DE2B05EAD3E1DB1587898448540F61C20CC1934B88A8158EE987CF04A002F92BEBD6B5C7DCAB9A183064357C3AC58A66A71F9A499BE14432551B8CDA14A09EECB6806592AE4B171EB39B46E13E604EC3EDE3762989E21AA010A6CB1121C6A014D2FE24234CB4FBB86A616AA65843E8382AC09D282F329AF20CDC4884AB3F64A0F5BEBF3D187BBF90411EEDED67557F60A3AB915F46D539E5CC7EB618E31720C8A04ACEA4F4A80BA524790C61EE3833C8676B204B51896175B2278187ED833E88BCA00A432CD147D6E8F0017EA6FCD247225419C21EBBE66B7C990940A36B3E49AFB580","0xF90171A0CA06C2B4C97D9941E56C3C752ABE4C2B0B2CD162E22A5D25F61774DC453DEEDFA03D3EB3E6727B6887FA8F2DE5F824572621CA7ED08C845A54B26158F1F383FAFE80A010F8B91C7AE81978FB4A930ED0F4765D46DFAEE99D7DFC8403B4893110CFAAD1A0ED90DBFDE0982512D27B81CECFE7A045350EA4CD9AC030B84ADC57AD780D1126A0525E7DD1BF391CF7DF9FFAAA07093363A2C7A1C7D467D01403E368BD8C1F4E56A0DBEB1DE9649B481C377B0D381EEA3F98B507A1C74CDDBDEFD2C6F4212482C9F6A00C63D33C99FE830146043F68586CB5989865E64B556668F56AF13AB0C975B308A046EA849B301050A23B2EB62A8F34477EFC4E6311290E0DDAC19C015AB0DCF3A5808080A045CB60DA8D809907E41951641C061A82FC7BEAF2D8C075AE0D5DB21073C935CDA0BDF39C6275DC5CBDA30F3E8C8B47E99C8DDC7DC7FCE69F4FC6646EFA7CEA3B95A0280190D9ACE4C413190BF53CD32DFCDF69AB4A0E0ADFB2F5DC513AFB3309716E8080","0xF87180A063696B31BF58B4455C3732254E2A52BFE8B9428DD073B7CFA4FF23F865ED059880A03ACA9D88035D7CF997118973B7FCF681F57AA04183C945F0E2ACE487F3592F5D808080808080808080A02E47BF88C4A7DE1540AD784E6BDBEE41F9163BC5270C0D5C7BC3F52D0739BE7D808080","0xF8719D20A65BD257638CF8CF09B8238888947CC3C0BEA2AA2CC3F1C4AC7A3002B851F84F018B01B3BF81F1BAB286025A19A08AAF510037CEED08F6A6D1462A5B93A2953BCB6F0720930133F311C0DC694B2CA0D0A06B12AC47863B5C7BE4185C2DEAAD1C61557033F56C7D4EA74429CBB25E23"],"address":"0xc02aaa39b223fe8d0a0e5c4f27ead9083c756cc2","balance":"0x1b3bf81f1bab286025a19"}}}],"id":"VL-RSI-006","relation_id":"account-proof-root-balance","relation_profile_id":"verify-layer.proof-context.v0","relation_profile_version":"0","schema":"profiled-relation-fixture.v0"}
