{"cases":[{"case_id":"actor_is_signer","inputs":{"record":{"admission":{"bound_envelope_hash":"faa282ce02c8b7759a66ada63abd4b6c9ae38035f21f288cc898dd6e5067d5b3","signer_identity_evidence":{"pubkey":"59ae1763f5bb7bfe78525dc1c98de50ba439b782e6824d89d8af313b14c31230","publication_pointer":"https://api.babyblueviper.com/ledger (verifier_pubkey is self-described in the proof)"},"verdict_event":{"content":"{\"artifact_hash\":\"faa282ce02c8b7759a66ada63abd4b6c9ae38035f21f288cc898dd6e5067d5b3\",\"artifact_type\":\"onchain_action\",\"confidence\":0.95,\"schema\":\"invinoveritas.verdict_proof.v1\",\"verdict\":\"reject\",\"verified_at\":1782600000,\"verifier_pubkey\":\"59ae1763f5bb7bfe78525dc1c98de50ba439b782e6824d89d8af313b14c31230\"}","created_at":1782600000,"id":"b1c173c468f6ca40536c040f38d65fabf04746f1e22ec42cace76b11ad3f0b6e","kind":30078,"pubkey":"59ae1763f5bb7bfe78525dc1c98de50ba439b782e6824d89d8af313b14c31230","sig":"022dae3a2322bd290ef08a1552790a84a271634403173d32ace068d07cc05bf49c46398bf44c0963dff3d0089dffeecb64620f0dabaf261bf5fb778df3ba585e","tags":[["t","invinoveritas"],["t","proof"]]}},"anchor":{"accepted_anchor_point":{"block_time":1782600300,"note":"DECLARED trust input. A deployment verifier resolves this from the anchor proof via `ots verify`; see live_confirmed_anchor.json for a real Bitcoin-confirmed instance.","source":"opentimestamps-bitcoin"},"anchor_proof_ots_b64":null,"commitment_digest":"b1c173c468f6ca40536c040f38d65fabf04746f1e22ec42cace76b11ad3f0b6e","terminal_outcome_time":1782600600},"canonical_envelope":{"canonical_bytes_utf8":"{\"action\":\"erc20_transfer\",\"amount\":\"115792089237316195423570985008687907853269984665640564039457584007913129639935\",\"chainId\":\"8453\",\"spender\":\"0x1f9840a85d5aF5bf1D1762F925BDADdC4201F984\",\"to\":\"0x000000000000000000000000000000000000dEaD\",\"token\":\"0xA0b86991c6218b36c1d19D4a2e9Eb0cE3606eB48\"}","canonicalization":"json-sorted-keys-utf8-nows","expected_envelope_hash":"faa282ce02c8b7759a66ada63abd4b6c9ae38035f21f288cc898dd6e5067d5b3","raw_input":{"action":"erc20_transfer","amount":"115792089237316195423570985008687907853269984665640564039457584007913129639935","chainId":"8453","spender":"0x1f9840a85d5aF5bf1D1762F925BDADdC4201F984","to":"0x000000000000000000000000000000000000dEaD","token":"0xA0b86991c6218b36c1d19D4a2e9Eb0cE3606eB48"}},"chain":{"pre_action":{"action_ref":"act-faa282ce02c8b775","actor_pubkey":"59ae1763f5bb7bfe78525dc1c98de50ba439b782e6824d89d8af313b14c31230","created_at":1782599900,"envelope_hash":"faa282ce02c8b7759a66ada63abd4b6c9ae38035f21f288cc898dd6e5067d5b3"},"terminal":{"action_ref":"act-faa282ce02c8b775","executed_envelope_hash":"faa282ce02c8b7759a66ada63abd4b6c9ae38035f21f288cc898dd6e5067d5b3","result":"executed","terminal_outcome_time":1782600600}},"trust_policy":{"independent_verifier_pubkeys":["6786e18a864893a900bd9858e650f67ccc3513f248fed374b591e2ff6922fbb7"],"policy":"An admission verdict counts as independent iff its signing pubkey is in independent_verifier_pubkeys AND is not the actor/executor pubkey in the chain."}}}}],"id":"JEX-RSI-005","relation_id":"signed-verdict-terminal-record-binding","relation_profile_id":"erc8299.judgment-record-binding.v0","relation_profile_version":"0","schema":"profiled-relation-fixture.v0"}
