{"cases":[{"case_id":"rpc_header_only","inputs":{"address":"0xc02aaa39b223fe8d0a0e5c4f27ead9083c756cc2","header":{"number":"0x18bf439","stateRoot":"0x3cb08f43bb7e9249e250d889871d113a5799264ccff284bf71179f33217481a8"},"response":{"accountProof":["0xf90211a09fcabf41b4c785369e88cf22d3981d1c95bcfe1066f937618db7e01dd75d9916a080f2187a2f8869012599112354afe3748ba20a46c5a90fd6b2c43ca50aa46422a043832b63f075c1b4d24d070e193625640362ac2eb11beff462745a1b4b3f8425a0bdf0b010a575a54b7c13f10c5d9f2a8f06db32f2b8127fecb6e6e9aebe5d8dcaa04f1dafb0ead703a11db691e486ab6e92b817f8cdd78c09d2207466c5bc13249ca024a91ded3afcb59b01d808702b0763842f671f0c87f0e5dcf752616af04a205fa09361e03af372bec5eddfe63c114a647fb16576ce9d8e7b3c6bdfb4941ce0722da02715b7f0ccda34b63cdddea7359e27b9ea6f359d93d10b27a9e02adf1e04bd1ba024effe7abab6300393ecff02c7b8b049bb0b9f2d7f6c87eebab9ebaa9c8a44fda0ab2f92ca997f219436577dc1796658714050c433e17edf127129b220bc0bab85a0ad75cc9e9b85d94df9d0983a13c757937ab47f96bc79227c83163591e70525baa0f62269d77e3e93dfa8d03e583a39855dfc388451393e41be255000c7131b172da07d91958219dc3603c9e533d4a04336c653ccebe8c33982a10be36d83de4f534aa006e9b9d25050a20c60f427eace06546385464a372f1e40fc1477d0ab14e84db4a012b07607f500c40865c7524daa250d0c8c8fd364c1b9f0b02c4fdebb7ae3a143a090d917f17a132ad555c86eadfb9a4ff1e4e7ddeb4fd66a6f34dbd8d2ddfd608680","0xf90211a0e255d95cfe3fcbfc6dc47773117c62358326e459589b8b61e1638c55cd6a52c3a0bf5adc0b6a5c124e17a67107b9260cdb66e9635a70d3aa38e6c980e256ddfe3da065d32d71ef4f987ef081f4b4dffe815f0a3e44c1f527ea48be176fa7ce054232a04cee37c7d999a5f35ef729c8c6eccb35dec5fb663d2045f96c087462b390216da03d492a68a7429496f856f7081b8269089ab75db9cc8d66d9024a6d82f6d46d06a005d0a800985fb45195c0df744359105453d9ef4db83d5a7ca6c2049bf428cd30a0f75094050c9a7c84ade519061b9766416e5dbf9758df7c3f1d6fdef7b28b1561a07e2be7b32363c989436a66490c4288b3501b0cd997ceec37e42359162e36268ea0b7dee5c25a1c8a8c37321c15de0c4a359fe5c0d3391c6351ffd3322c2a8e2620a002833ddd961c73329fd889e8f752969b80d5b1a759ed41a650674969e6b4f6faa03d2e7818113cc8e5cf9d2de4f3fd02bba547adee08f7e81d410920790f359c4ca0bc4fdb40550a726b133f59f3577f6deb77bb72308dfb36cb312cbef92795a08ba05cbcef58a164624b03433bd10944fb85a664c5b528ef4d4e026af7a8e915f467a09bf77ea5abe8bd64d75b2fa0b95c1c666bbedf2733643c19420fee0e06b7c2f4a04efae3b32a17bad48dd09ca795d769b2cdd8ce8110427ae85ec1752b5679f30ca0eb7894c3b0b90224d2d1aee156d9a01115104854ce745755faf30850ebf03bc380","0xf90211a0a4f3c76882fc316bfcd5eab42786da14ae70e7739859ccf184957382b225b934a0351761f108314679a25b74493e7d4dd5f2b6a3f8313dcf6f67a1e8717c71f612a08d954911546c940abdf2e721d4fcff036423dee70a2209ccb306fb4984cfd411a00ccbff395f543e44020e3728f8df297fc9d43ae8c103d3b581017464243c23c4a0c074eaca10251d0275de099ab6fea3ad389843381c0e8bc76f6174e88dcef6ada0d74be35911dfa067341fadc178b0d17055003126ea669eb07d2110f85062a0eda0980fedc1c30f9cc569b0d6d9ce9772950d761fde3f881461ec2c04e163b4da4ea08e12baacc1522ebfd7afb059415d2f5fe711f3f1cdff9241c6dc4cdfadc9ff80a0f01b09a150b3421be513f9e355bbca3dd27a26d1c7ec948c8b959e963adc89f6a01a7b20b34c3ac0859c9fbace722a6ffbc55921cbc26504c7e7d9122db963799ea0668eefa71ce275f6468652cffb74c2ab4c50fa60ddb837dc47edad9a37872ae1a06983cab313f25b24a183c9604a028a8315c2043148a6fa584353239f4a587edfa0af87b0da52654d8f33ec7c6aa78f260b318aafd827fb923faaf9e2bd07302c82a0cad9d267939d6d56080e2b9829f1ec2d81abf1cdaef30934422b34b0ede18b46a0be5309d6b2084b7935cdbef8d82f9e3d50b560b3027f598c6f9434feaf5b5851a0bf2847bd05cecf14897e9a8143f86c69c4ab884e489ad89e5ece3deea66930c780","0xf90211a0b3e5c3b5cf073575fc70495af2e4bc0b77d7c4db2021fb6b20a7f5d2a1ac62f7a0626136dfc0b7651c199bfad6b61e0c0d1e5650cde1a695c04dac9d2c150830b4a0c4985581651b505b15cebda08f53660dedd87b1f23103ceacea6a62b4939e20fa0cd29ff0c4cb6830321b65070b7d3f0e34c4f688a51013e52e35fd97f3b1acf68a04c56608de579fa87eb67aa0823899ad5f326b0eef8b33aaf0d0a34b4b32001b2a09fb42725d914dd4a71daca7eae44742c74bf9c69243a336ed46daebd7f3713f5a0ced6b0ff6ca108c28e9ad917787092ef3b8c0e12fb286e58a543f27a44afef30a0b289c2941c0a4ec81f3ec85e7609562edaa901e3aa03d9871348427e593b38fca08d4668a0365743314ee9db78d2cc56655e7000e652d08d7288cf187b9b5fac43a0f2a0802f0ca429a204973f20f4af02a0639fc73da69595a46aceb9dbe9e1b542a03dda6c249bf0967f04ddd7cd1ecd98d8fb9ef6fc8c8f4d1976f30e54384a7528a0e19012d64951e6baf34c91f0d8164b47eb467e1bd1cb114feb0c92c9cd02dbf9a0a8b120e63356b04094e710b18d7388972e2f3a565ea617e82d14c0264ab6aca6a0602b102b0cf24086d7dfa0fe5901356e337a17e2d9fdfb3792c7ce2b63a67afda0d1a10dcaaf965fc48fe03935ee9c13cff4981f67db49451d58f3c92205c9bbd0a086934325cd02e1f3932d013b27ec2e1d38ee38dd204aaafb09dffd83fcb9361f80","0xf90211a04262ff58e15a0db5f25d470bf6e5d01ee51b078ac316a5c1d0c9c8477c107fd9a0d8b9ecb74dbb9348012c5a50b677e204c366b6a59bcdced5ec70f473b2dbc07ea05551289d7d0ca8e6ed0e9b94eaaebbde60817b3c8062d015b39a664a86571f48a0e114704dfcdfc605ab731c8c7d0a750e807a234ecbaab53eb5c8f0fda36ec476a08411f5aef7ac385d03abd621c1c9863b733fbfc620ed786b24d61d613c7b1340a025d0300730736a5b973395b21e51018c084832563eacc30bd64b16f7650886aaa0d339eaccd8f171b13eaa0afbec7b0ec1d5a39f25ff3defc0a34898e228878442a094fcdb554a2b537a717cc37f442992342aee297bd6069a96c0c68bc6a3d4698ca04e3eae18173a40baccd0fc364c2b3220a81c41985cb31e039f78affcdecd085ea06d49a6c2ce8cb52722e864f1c6aef2cc843c02914c76c6fb007db9cfd1d7b0c7a05cb40e6810a22a3e6258182774108b72c3a1962ff46480d9751dbfa66b4d672ba0895ffb095fcfd8c97b1ac08e5a15146282024d29435b1dfe593523a5e261ad8ca0b0c96ddf97b4df21a269534d709cc74020bf97a9904601103f314ced8c301dfaa07cd8135a7a88294c7ef23b2796eb705d6cb84774f5c84e08954ab53f12cd6774a09c8492a19ff11d58a04ad77ca6d95aa0ca614953b390594975dfb53e4b653d88a0883441b4ecd17b93b876acee6af28a958648b99a1b3d3c159dae449f9a036cd880","0xf90211a084cc796287f296ba8a48db60bdc70e0a6452f12d9b69b35ba8664d91a45bedc4a0b22c12062b8f48d8f92be9784e41c88365d91b7732de1d9bf3138830bedaac99a0d47c5d8506cae00c45119acde736e877d3d8956899a7cdcc98cfda4d40d169f8a04f06983240af1cfde15fb0be9c7aabaabc166e6d3f7ad299b6869ef963a6120fa038ebca901ab26be6972b06e71a2b6a13b7fed253c5ab88c9e28e8664a03faf16a0855712345394943b5696820d056061c95bc30647907547009013d4d44f1322baa09c7a5515f935f6d52d04703044f9407b6334f408a9e26c463af5306ea3c4e1b4a092785b9f1f414d3df467823a100a19be8f098e13885bba867c4e0c70cd45450aa0276455e60507eaedc9a329b4f268981fbf6b80a26c6346b3404c75a40afb46a7a05ef32bb7de2b05ead3e1db1587898448540f61c20cc1934b88a8158ee987cf04a002f92bebd6b5c7dcab9a183064357c3ac58a66a71f9a499be14432551b8cda14a09eecb6806592ae4b171eb39b46e13e604ec3ede3762989e21aa010a6cb1121c6a014d2fe24234cb4fbb86a616aa65843e8382ac09d282f329af20cdc4884ab3f64a0f5bebf3d187bbf90411eeded67557f60a3ab915f46d539e5cc7eb618e31720c8a04acea4f4a80ba524790c61ee3833c8676b204b51896175b2278187ed833e88bca00a432cd147d6e8f0017ea6fcd247225419c21ebbe66b7c990940a36b3e49afb580","0xf90171a0ca06c2b4c97d9941e56c3c752abe4c2b0b2cd162e22a5d25f61774dc453deedfa03d3eb3e6727b6887fa8f2de5f824572621ca7ed08c845a54b26158f1f383fafe80a010f8b91c7ae81978fb4a930ed0f4765d46dfaee99d7dfc8403b4893110cfaad1a0ed90dbfde0982512d27b81cecfe7a045350ea4cd9ac030b84adc57ad780d1126a0525e7dd1bf391cf7df9ffaaa07093363a2c7a1c7d467d01403e368bd8c1f4e56a0dbeb1de9649b481c377b0d381eea3f98b507a1c74cddbdefd2c6f4212482c9f6a00c63d33c99fe830146043f68586cb5989865e64b556668f56af13ab0c975b308a046ea849b301050a23b2eb62a8f34477efc4e6311290e0ddac19c015ab0dcf3a5808080a045cb60da8d809907e41951641c061a82fc7beaf2d8c075ae0d5db21073c935cda0bdf39c6275dc5cbda30f3e8c8b47e99c8ddc7dc7fce69f4fc6646efa7cea3b95a0280190d9ace4c413190bf53cd32dfcdf69ab4a0e0adfb2f5dc513afb3309716e8080","0xf87180a063696b31bf58b4455c3732254e2a52bfe8b9428dd073b7cfa4ff23f865ed059880a03aca9d88035d7cf997118973b7fcf681f57aa04183c945f0e2ace487f3592f5d808080808080808080a02e47bf88c4a7de1540ad784e6bdbee41f9163bc5270c0d5c7bc3f52d0739be7d808080","0xf8719d20a65bd257638cf8cf09b8238888947cc3c0bea2aa2cc3f1c4ac7a3002b851f84f018b01b3bf81f1bab286025a19a08aaf510037ceed08f6a6d1462a5b93a2953bcb6f0720930133f311c0dc694b2ca0d0a06b12ac47863b5c7be4185c2deaad1c61557033f56c7d4ea74429cbb25e23"],"address":"0xc02aaa39b223fe8d0a0e5c4f27ead9083c756cc2","balance":"0x1b3bf81f1bab286025a19"}}}],"id":"VL-RSI-007","relation_id":"account-proof-root-balance","relation_profile_id":"verify-layer.proof-context.v0","relation_profile_version":"0","schema":"profiled-relation-fixture.v0"}
